{
    "$schema": "http://json-schema.org/draft-07/schema#",
    "title": "ChatConversation",
    "type": "object",
    "properties": {
        "conversation_id": {
            "type": "string"
        },
        "title": {
            "type": "string"
        },
        "model": {
            "type": "string"
        },
        "system_prompt": {
            "type": "string"
        },
        "created_at": {
            "type": "string",
            "format": "date-time"
        },
        "updated_at": {
            "type": "string",
            "format": "date-time"
        },
        "owner": {
            "type": [
                "string",
                "null"
            ]
        },
        "participants": {
            "type": "object",
            "properties": {
                "user": {
                    "type": "object"
                },
                "assistant": {
                    "type": "object"
                }
            }
        },
        "messages": {
            "type": "array",
            "items": {
                "$ref": "#/definitions/Message"
            }
        }
    },
    "required": [
        "conversation_id",
        "title",
        "model",
        "created_at",
        "updated_at",
        "messages"
    ],
    "definitions": {
        "Message": {
            "type": "object",
            "properties": {
                "role": {
                    "type": "string",
                    "enum": [
                        "system",
                        "user",
                        "assistant",
                        "tool"
                    ]
                },
                "content": {
                    "type": "string"
                },
                "timestamp": {
                    "type": "string",
                    "format": "date-time"
                },
                "metadata": {
                    "type": "object"
                },
                "usage": {
                    "type": "object",
                    "properties": {
                        "prompt_tokens": {
                            "type": [
                                "integer",
                                "null"
                            ]
                        },
                        "completion_tokens": {
                            "type": [
                                "integer",
                                "null"
                            ]
                        },
                        "total_tokens": {
                            "type": [
                                "integer",
                                "null"
                            ]
                        }
                    }
                }
            },
            "required": [
                "role",
                "content",
                "timestamp"
            ]
        }
    }
}