{
  "conversation_id": "619805f5f5d2",
  "title": "First chat",
  "model": "gpt-4o-mini",
  "system_prompt": "You are a helpful assistant.",
  "created_at": "2025-10-30T08:31:33Z",
  "updated_at": "2025-10-30T08:31:33Z",
  "owner": "127.0.0.1",
  "messages": [],
  "participants": {
    "user": {
      "name": "user"
    },
    "assistant": {
      "name": "assistant"
    }
  }
}