{
  "conversation_id": "b41cdca7c219",
  "title": "first chAT",
  "model": "gpt-4o-mini",
  "system_prompt": "You are a helpful assistant.",
  "created_at": "2025-10-27T15:35:04Z",
  "updated_at": "2025-10-27T15:35:04Z",
  "owner": "68ff90f63303287a91b86295",
  "messages": [],
  "participants": {
    "user": {
      "name": "user"
    },
    "assistant": {
      "name": "assistant"
    }
  }
}