{
  "conversation_id": "3f138f02fd35",
  "title": "New Conversation",
  "model": "gpt-4o-mini",
  "system_prompt": "You are a helpful assistant.",
  "created_at": "2025-10-30T11:02:42Z",
  "updated_at": "2025-10-30T11:02:42Z",
  "owner": "45f94d66744545cd8b9e4113498a9065",
  "messages": [],
  "participants": {
    "user": {
      "name": "user"
    },
    "assistant": {
      "name": "assistant"
    }
  }
}