{
  "conversation_id": "00174cad3105",
  "title": "first",
  "model": "gpt-4o-mini",
  "system_prompt": "You are a helpful assistant.",
  "created_at": "2025-10-27T17:49:05Z",
  "updated_at": "2025-10-27T17:49:05Z",
  "owner": "68ffb08d259a547ccc6d86bb",
  "messages": [],
  "participants": {
    "user": {
      "name": "user"
    },
    "assistant": {
      "name": "assistant"
    }
  }
}